{
  "specVersion": "1.0.0",
  "type": "sv_while",
  "version": 1,
  "category": "flow",
  "title": "While",
  "priority": "P1",
  "opcode": "control.while",
  "container": true,
  "props": [
    {
      "name": "condition",
      "kind": "expression",
      "required": true,
      "valueType": "boolean"
    },
    {
      "name": "maxIterations",
      "kind": "integer",
      "required": true,
      "default": 1000,
      "min": 1,
      "max": 1000000
    },
    {
      "name": "intervalMs",
      "kind": "duration",
      "required": false,
      "default": 0,
      "min": 0
    }
  ],
  "outputs": [
    {
      "name": "index",
      "type": "uint32"
    }
  ],
  "handles": {
    "in": [
      "target"
    ],
    "out": [
      "loop-start-source",
      "loop-end-source"
    ]
  }
}
