{
  "specVersion": "1.0.0",
  "type": "sv_expression",
  "version": 1,
  "category": "logic",
  "title": "Expression",
  "priority": "P0",
  "opcode": "expr",
  "props": [
    {
      "name": "expr",
      "kind": "expression",
      "required": true
    }
  ],
  "outputs": [
    {
      "name": "result",
      "type": "$inferred"
    }
  ],
  "handles": {
    "in": [
      "target"
    ],
    "out": [
      "source",
      "error"
    ]
  }
}
