{
  "specVersion": "1.0.0",
  "type": "sv_state_machine",
  "version": 1,
  "category": "state",
  "title": "State machine",
  "priority": "P2",
  "opcode": "control.branch",
  "props": [
    { "name": "name", "kind": "string", "required": true },
    {
      "name": "transitions",
      "kind": "list",
      "required": true,
      "items": [
        { "name": "from", "kind": "expression", "required": false },
        { "name": "when", "kind": "expression", "required": true },
        { "name": "to", "kind": "expression", "required": true }
      ]
    }
  ],
  "outputs": [],
  "handles": { "in": ["target"], "out": ["changed", "unchanged"] }
}
